{
  "$schema": "https://json-schema.org/draft/2020-12/schema",
  "$id": "https://tailing.future/schemas/atomistic-full-candidate-plan/0.1",
  "title": "Tailing Future Atomistic Full Candidate Plan",
  "description": "A frozen, non-promotional 693-by-two candidate evaluation contract. It does not amend or satisfy the formal atomistic reproduction receipt.",
  "type": "object",
  "required": ["schemaVersion", "status", "frozenAt", "purpose", "bindings", "execution", "metrics", "acceptance", "resultPolicy", "claimBoundaries", "scientificGatesPending"],
  "properties": {
    "schemaVersion": { "const": "tf.atomistic-full-candidate-plan/0.1" },
    "status": { "const": "frozen-candidate-contract-not-run" },
    "frozenAt": { "const": "2026-08-30" },
    "purpose": { "type": "string", "minLength": 80 },
    "bindings": { "$ref": "#/$defs/bindings" },
    "execution": { "$ref": "#/$defs/execution" },
    "metrics": { "$ref": "#/$defs/metrics" },
    "acceptance": { "$ref": "#/$defs/acceptance" },
    "resultPolicy": { "$ref": "#/$defs/resultPolicy" },
    "claimBoundaries": { "$ref": "#/$defs/claimBoundaries" },
    "scientificGatesPending": {
      "type": "array",
      "minItems": 6,
      "uniqueItems": true,
      "items": { "type": "string", "minLength": 20 }
    }
  },
  "additionalProperties": false,
  "$defs": {
    "digest": { "type": "string", "pattern": "^sha256:[0-9a-f]{64}$" },
    "scientificPlanBinding": {
      "type": "object",
      "required": ["path", "schemaVersion", "rawDigest"],
      "properties": {
        "path": { "const": "evaluation/atomistic/reproduction-plan.json" },
        "schemaVersion": { "const": "tf.atomistic-reproduction/0.2" },
        "rawDigest": { "const": "sha256:d3a58524029b51c598d00a7bb9f60b6479a9973a0f9907cbf94a31e61bf1c9c2" }
      },
      "additionalProperties": false
    },
    "modelRuntimeIdentity": {
      "type": "object",
      "required": ["dependencyLockDigest", "runtimeInputManifestDigest"],
      "properties": {
        "dependencyLockDigest": { "$ref": "#/$defs/digest" },
        "runtimeInputManifestDigest": { "$ref": "#/$defs/digest" }
      },
      "additionalProperties": false
    },
    "runtimeLockBinding": {
      "type": "object",
      "required": ["path", "schemaVersion", "rawDigest", "stableInputsCommitment", "sourceManifestDigest", "materializationDigest", "runnerDigest", "modelRuntimeIdentities", "ociPromotionTrustRootsAvailable"],
      "properties": {
        "path": { "const": "evaluation/atomistic/runtime-lock.json" },
        "schemaVersion": { "const": "tf.atomistic-runtime-lock/0.3" },
        "rawDigest": { "const": "sha256:b8c352aacfef3f74210d2dbf2002400887e35d21670f5f93da6a8003670bafa1" },
        "stableInputsCommitment": { "const": "sha256:b4183913307ca0810813c66a3963de1cb20f63ae2000121f9d1016eac94fbfcb" },
        "sourceManifestDigest": { "const": "sha256:08b1ed2ae239ce5732cf565b5e7bd814727a99ad6e1e1a29aeaa21ea1ed529a1" },
        "materializationDigest": { "const": "sha256:345d5e55227bbe873d567f5ea72b88db1f21c1d46e72f078db38e6a455d47721" },
        "runnerDigest": { "const": "sha256:d6e83640f15926088c116312c27605570f9e9c8ba4e9a9988ef5bf4d3a974ed4" },
        "modelRuntimeIdentities": {
          "type": "object",
          "required": ["mattersim", "mace"],
          "properties": {
            "mattersim": {
              "allOf": [
                { "$ref": "#/$defs/modelRuntimeIdentity" },
                { "type": "object", "properties": {
                  "dependencyLockDigest": { "const": "sha256:9c990909d1307bb32608d31b9ed217d2368c28e2048f6dec39e8dc4a2b63642b" },
                  "runtimeInputManifestDigest": { "const": "sha256:203acc5ec09c2e76a819ff384573c2c0aca1316f90c53f2e735c98e9daab5c53" }
                } }
              ]
            },
            "mace": {
              "allOf": [
                { "$ref": "#/$defs/modelRuntimeIdentity" },
                { "type": "object", "properties": {
                  "dependencyLockDigest": { "const": "sha256:ae4b21b6f6d8ad98edcf2d5e0d938cd563379f494cce0b4aaa2e987332147e33" },
                  "runtimeInputManifestDigest": { "const": "sha256:6bb7f79c5380bb54b0d5ff972c3f22cc27623d131291d3a7c1b2c4efff826f47" }
                } }
              ]
            }
          },
          "additionalProperties": false
        },
        "ociPromotionTrustRootsAvailable": { "const": false }
      },
      "additionalProperties": false
    },
    "benchmarkBinding": {
      "type": "object",
      "required": ["id", "datasetDigest", "idSetDigest", "idManifestPath", "recordManifestDigest", "recordManifestProtocol", "structureManifestDigest", "structureManifestProtocol", "labelManifestDigest", "labelManifestProtocol", "frames", "atoms", "elements", "atomsPerFrame", "redistributionAllowed"],
      "properties": {
        "id": { "const": "mattersim-random-tp" },
        "datasetDigest": { "const": "sha256:c14473dcf4bd71e1ed11556ac9ff12b68e7a423d813f939bc9eedaef663054d9" },
        "idSetDigest": { "const": "sha256:4df1ba7cda1b0a31cdb0b3e2281ed535327d7b92ce381cd930c781cc8b800f91" },
        "idManifestPath": { "const": "evaluation/atomistic/random-tp-id-manifest.txt" },
        "recordManifestDigest": { "const": "sha256:6afbbdc0cd745efaca4bf5d7a2a7604db9f1d1f59749b86d3c0a51d48f07893a" },
        "recordManifestProtocol": { "const": "tf.random-tp.record-manifest/v1" },
        "structureManifestDigest": { "const": "sha256:b0a94b5424f9d4a2be7519265b8dbe89a478fa5b21a6c956c70ffe0c705078f7" },
        "structureManifestProtocol": { "const": "tf.atomistic-structure-manifest/v1" },
        "labelManifestDigest": { "const": "sha256:a0eda4ac1c7720002a32f42f91c635bf8398b93c02846fb83ae97437e3e8422f" },
        "labelManifestProtocol": { "const": "tf.random-tp.reference-label-manifest/v1" },
        "frames": { "const": 693 },
        "atoms": { "const": 11088 },
        "elements": { "const": 89 },
        "atomsPerFrame": { "const": 16 },
        "redistributionAllowed": { "const": false }
      },
      "additionalProperties": false
    },
    "bindings": {
      "type": "object",
      "required": ["scientificPlan", "runtimeLock", "benchmark"],
      "properties": {
        "scientificPlan": { "$ref": "#/$defs/scientificPlanBinding" },
        "runtimeLock": { "$ref": "#/$defs/runtimeLockBinding" },
        "benchmark": { "$ref": "#/$defs/benchmarkBinding" }
      },
      "additionalProperties": false
    },
    "mattersimPartition": {
      "const": {
        "partitionId": "mattersim-full-000",
        "model": "mattersim",
        "modelId": "mattersim-v1.0.0-5m",
        "selection": "all-693-ids-from-frozen-manifest-in-ascii-order",
        "expectedRecords": 693,
        "partitionIndex": 0,
        "partitionCount": 1
      }
    },
    "macePartition": {
      "const": {
        "partitionId": "mace-full-000",
        "model": "mace",
        "modelId": "mace-mpa-0-medium",
        "selection": "all-693-ids-from-frozen-manifest-in-ascii-order",
        "expectedRecords": 693,
        "partitionIndex": 0,
        "partitionCount": 1
      }
    },
    "execution": {
      "type": "object",
      "required": ["profile", "mode", "canonicalDevice", "dtype", "batchSize", "threads", "networkPolicy", "producerReferenceLabelAccess", "independentVerifierReferenceLabelAccess", "mixedRunAttemptsAllowed", "partitioning"],
      "properties": {
        "profile": { "const": "full-candidate" },
        "mode": { "const": "full" },
        "canonicalDevice": { "const": "cpu" },
        "dtype": { "const": "float32" },
        "batchSize": { "const": 1 },
        "threads": { "const": 1 },
        "networkPolicy": { "const": "fetch-online-build-and-run-offline" },
        "producerReferenceLabelAccess": { "const": false },
        "independentVerifierReferenceLabelAccess": { "const": true },
        "mixedRunAttemptsAllowed": { "const": false },
        "partitioning": {
          "type": "object",
          "required": ["partitionKey", "currentStrategy", "futureShardingPolicy", "partitions"],
          "properties": {
            "partitionKey": { "const": "model" },
            "currentStrategy": { "const": "one-complete-id-set-partition-per-model" },
            "futureShardingPolicy": { "type": "string", "minLength": 80 },
            "partitions": {
              "type": "array",
              "minItems": 2,
              "maxItems": 2,
              "prefixItems": [
                { "$ref": "#/$defs/mattersimPartition" },
                { "$ref": "#/$defs/macePartition" }
              ],
              "items": false
            }
          },
          "additionalProperties": false
        }
      },
      "additionalProperties": false
    },
    "metrics": {
      "const": {
        "definitionId": "mattersim-model-card-frobenius/v1",
        "energyError": "absolute-total-energy-error-divided-by-frame-atom-count",
        "forceError": "mean-per-atom-l2-vector-error-per-frame",
        "stressGateError": "full-3x3-frobenius-error-in-gpa-per-frame",
        "stressDiagnostics": ["spectral-norm", "unweighted-voigt6-l2", "six-component-mae"],
        "evA3ToGpa": 160.21766208,
        "aggregation": "equal-weight-structure-mean-float64",
        "summation": "ascii-id-order-python-3.12-math-fsum-divide-by-693/v1",
        "quantileMethod": "Hyndman-Fan-7-linear",
        "quantiles": [0.5, 0.9, 0.95, 0.99],
        "reportedStatistics": ["mean", "p50", "p90", "p95", "p99", "worst"],
        "worstTieBreak": "error-descending-then-ascii-id-ascending",
        "perIdMetricEvidenceRootProtocol": "sha256-merkle-canonical-json-array-model-id-metric-id-error-ascii-id-order-duplicate-id-forbidden/v1",
        "binary64MetricEvidenceRootProtocol": "sha256-merkle-domain-separated-model-id-metric-id-ieee754-binary64-little-endian-ascii-id-order-duplicate-id-forbidden/v1"
      }
    },
    "metricIntervals": {
      "const": {
        "energyMaeEvPerAtom": [0.19502, 0.20298],
        "forceVectorMaeEvPerAngstrom": [0.80752, 0.84048],
        "stressFrobeniusMaeGpa": [1.95902, 2.03898]
      }
    },
    "acceptance": {
      "type": "object",
      "required": ["completeness", "mattersim", "mace"],
      "properties": {
        "completeness": {
          "const": {
            "requiredModels": 2,
            "requiredRecordsPerModel": 693,
            "requiredTotalPredictions": 1386,
            "allowedMissing": 0,
            "allowedExtra": 0,
            "allowedDuplicate": 0,
            "allowedFailed": 0,
            "allowedNonfinite": 0
          }
        },
        "mattersim": {
          "type": "object",
          "required": ["model", "assessment", "conjunction", "targets", "acceptedIntervals", "officialOrBitExactClaimAllowed"],
          "properties": {
            "model": { "const": "mattersim" },
            "assessment": { "const": "protocol-equivalent-model-card-interval-check" },
            "conjunction": { "const": "energy-and-force-and-stress" },
            "targets": { "const": { "energyMaeEvPerAtom": 0.199, "forceVectorMaeEvPerAngstrom": 0.824, "stressFrobeniusMaeGpa": 1.999 } },
            "acceptedIntervals": { "$ref": "#/$defs/metricIntervals" },
            "officialOrBitExactClaimAllowed": { "const": false }
          },
          "additionalProperties": false
        },
        "mace": {
          "const": {
            "model": "mace",
            "assessment": "blind-engineering-baseline",
            "publishedRandomTpTargetAvailable": false,
            "fitOffsetScaleOrSignAfterObservationAllowed": false,
            "superiorityClaimAllowed": false
          }
        }
      },
      "additionalProperties": false
    },
    "claims": {
      "const": {
        "claimEligible": false,
        "promotionEligible": false,
        "comparisonEligible": false,
        "reproductionEligible": false,
        "reproduced": false,
        "superiorityClaimAllowed": false
      }
    },
    "resultPolicy": {
      "type": "object",
      "required": ["allowedOutcomes", "completePass", "completeFail", "incomplete", "claims"],
      "properties": {
        "allowedOutcomes": { "const": ["complete-pass", "complete-fail", "incomplete"] },
        "completePass": { "type": "string", "minLength": 60 },
        "completeFail": { "type": "string", "minLength": 60 },
        "incomplete": { "type": "string", "minLength": 60 },
        "claims": { "$ref": "#/$defs/claims" }
      },
      "additionalProperties": false
    },
    "claimBoundaries": {
      "const": {
        "randomTpIsMatbenchWbm": false,
        "matterSimInterpretation": "frozen-frobenius-protocol-equivalent-only",
        "maceInterpretation": "blind-engineering-baseline-only",
        "currentSotaClaimAllowed": false,
        "experimentalGroundTruthClaimAllowed": false,
        "industrialFitnessClaimAllowed": false,
        "crossModelSuperiorityClaimAllowed": false
      }
    }
  }
}
